{
  "kind": "enterprise_governance_source",
  "schema_version": "v1",
  "source_id": "src.<org>.<intent>",
  "source_type": "operational-rule-sheet",
  "title": "Enterprise Governance Source Template",
  "owner": {
    "organization_id": "<org-id>",
    "owner_team": "<team>"
  },
  "organization_scope": {
    "organization_ids": ["<org-id>"],
    "environment_classes": ["staging"],
    "session_scope": "workspace-bound"
  },
  "workspace_targets": ["<workspace-id>"],
  "domain_targets": ["digital"],
  "specialization_targets": ["remote-publication"],
  "declared_intent": "govern outbound publication",
  "source_format": "markdown_rule_sheet",
  "source_payload_ref": "governance/ingestion/examples/source_payloads/<payload>.md",
  "provenance": {
    "source_system": "manual-upload",
    "source_uri": "internal://policy-sheet"
  },
  "ingestion_status": "submitted",
  "confidence_hint": 0.9,
  "notes": "Template source intake",
  "created_at": "2026-03-09T00:00:00Z",
  "updated_at": "2026-03-09T00:00:00Z"
}
